{
  "meta": {
    "source_title": "qingning_chosen",
    "genre": "campus-redemption",
    "extracted_at": "2026-09-01",
    "sample_chapters": [
      1,
      2,
      3,
      4,
      5,
      6,
      7,
      8,
      9,
      10,
      12,
      13,
      14,
      15,
      16,
      19,
      20,
      21,
      22,
      23,
      26,
      27
    ],
    "total_sample_words": 35714,
    "confidence": 0.9,
    "human_reviewed": false,
    "source_fingerprint": {
      "pass2_character.json": "16ddd24ac94f9a69",
      "pass3_style.json": "a6e396a3b6ffc80a"
    }
  },
  "narration": {
    "pov": "第三人称限知",
    "pov_switch_rule": "",
    "tense_feel": "贴身跟随主角感官，叙述者几乎不介入",
    "sentence_rhythm": {
      "avg_length": 0,
      "short_ratio": 0,
      "long_ratio": 0,
      "burst_pattern": "叙述性段落句长稳定（平均29字），用于背景与内心铺陈。情绪或动作爆发点依赖【短句/单句成段】（如“她的心猛地一跳”、“是的，她怀孕了”），形成节奏顿挫。"
    },
    "paragraph": {},
    "chapter_opening_patterns": [
      {
        "pattern": "场景白描",
        "frequency": 3,
        "example_structure": "[环境状态]+[人物动作]"
      },
      {
        "pattern": "内心独白",
        "frequency": 2,
        "example_structure": "[心理活动]+[场景引入]"
      }
    ]
  },
  "dialogue": {
    "dialogue_ratio": 0.0737,
    "tag_style": "",
    "subtext_level": "直白",
    "character_voices": [
      {
        "name": "苏念",
        "role": "主角",
        "speech_signature": {
          "refusal_pattern": "当被要求直接向陆星辞求助时，会找借口回避，例如。",
          "never_says": [
            "直接说‘我喜欢陆星辞’",
            "公开表达对陆星辞的醋意",
            "用命令或强硬的语气对陆星辞说话"
          ],
          "verbal_tics": [
            "谢谢啊",
            "哪有那么夸张",
            "不弔了",
            "麻烦彵了",
            "我先走了",
            "别胡说",
            "我就是不知道穿什么",
            "妈！",
            "嗯？"
          ]
        },
        "arc": {}
      },
      {
        "name": "陆星辞",
        "role": "配角",
        "speech_signature": {
          "refusal_pattern": "面对他人的告白或不感兴趣的社交请求，使用礼貌但疏离的固定句式拒绝，如‘谢谢，不弔’或‘抱歉，影响学习’，然后直接转身离开，不给予任何进一步回应的空间。",
          "never_says": [
            "直接说出‘我喜欢苏念’",
            "对苏念说软话或明显安慰的话（如‘你很好，不要难过’）",
            "在外人面前主动表现出对苏念的特别关心"
          ],
          "verbal_tics": [
            "嗯？",
            "谢谢，不弔",
            "抱歉，影响学习",
            "我家近",
            "别哭",
            "喝水",
            "别听她胡说",
            "自己能想明白",
            "懂了吗",
            "哪里不会",
            "早",
            "不弔，我都准备好了"
          ]
        },
        "arc": {}
      },
      {
        "name": "夏栀",
        "role": "配角",
        "speech_signature": {
          "refusal_pattern": "（样本中未出现明确拒绝情境，置信度较低）",
          "never_says": [
            "严肃地、长时间地谈论自己的烦恼或心事",
            "对苏念的暗恋心态进行理性、冷静的分析",
            "用低调、含蓄的方式说话"
          ],
          "verbal_tics": [
            "念念",
            "哇哦",
            "陆大神",
            "走走走",
            "男友力，简直max",
            "别瞎说",
            "这待遇",
            "就跟你说个事儿"
          ]
        },
        "arc": {}
      },
      {
        "name": "江辰",
        "role": "配角",
        "speech_signature": {
          "refusal_pattern": "（样本中未出现明确拒绝情境，置信度较低）",
          "never_says": [
            "说任何正经、严肃、带有深刻情感的话",
            "安静地独处或长时间不说话"
          ],
          "verbal_tics": [
            "陆哥",
            "可以啊陆星辞",
            "哇",
            "切，装什么装"
          ]
        },
        "arc": {}
      }
    ]
  },
  "emotion_handling": {
    "mode": "直陈式",
    "body_reaction_vocabulary": [
      "她的心猛地一跳",
      "是的，她怀孕了",
      "八月初",
      "九月初",
      "婚后第二年春天",
      "巷口",
      "高铁站",
      "书房",
      "她很紧张/开心",
      "时光飞逝"
    ],
    "examples": [
      {
        "emotion": "通用",
        "pattern": "混合式（按场景切换）。日常等待、焦虑场景多用【环境投射式】，借时间感（慢放键）、空间规划（地铁线路画了又画）外化内心；关键动作瞬间（如听到喊名）用【体感式+动作外化式】组合（心猛地一跳，书“啪”地掉下，冲出房间）；长期状态或背景铺陈则偏向【直陈式】（最漫长也最甜蜜的煎熬）。",
        "anti_pattern": "情绪直陈：避免泛泛的“她很紧张/开心”，必须用身体反应或环境细节呈现。；静态描写：避免孤立的景物描写，所有环境细节（如阳光、雨丝、花香）都必须与人物当下的动作或心理状态紧密绑定。；抽象概括：避免对情感或时间做抽象定义（如“时光飞逝”），改为具体化、可感知的描述（如“时间像被按下了慢放键”）。"
      },
      {
        "emotion": "情绪直陈",
        "pattern": "必须用身体反应或环境细节呈现。",
        "anti_pattern": "避免泛泛的“她很紧张/开心”"
      },
      {
        "emotion": "静态描写",
        "pattern": "所有环境细节（如阳光、雨丝、花香）都必须与人物当下的动作或心理状态紧密绑定。",
        "anti_pattern": "避免孤立的景物描写"
      },
      {
        "emotion": "抽象概括",
        "pattern": "改为具体化、可感知的描述（如“时间像被按下了慢放键”）。",
        "anti_pattern": "避免对情感或时间做抽象定义（如“时光飞逝”）"
      }
    ]
  },
  "imagery": {
    "high_freq_metaphor_domains": [
      "时间物理化",
      "日常感官物件"
    ],
    "sensory_preference": {
      "visual": 0.457,
      "auditory": 0.241,
      "tactile": 0.19,
      "olfactory": 0.043,
      "gustatory": 0.069
    },
    "signature_devices": [
      "用具体、微小的感官细节（如斑驳光影、茉莉花香、汗味混杂油炸味）瞬间锚定场景情绪，替代直接抒情。"
    ]
  },
  "banned": {
    "never_used_words": [
      "恍若",
      "顿时",
      "霎时",
      "心中一震",
      "不由得",
      "倏地"
    ],
    "avoided_structures": [],
    "genre_taboos": []
  },
  "provenance": {
    "contains_verbatim": false,
    "abstraction_note": "四遍扫描产物，经 compliance.py 扫描，连续12字匹配原文已拒收"
  }
}