{
  "meta": {
    "source_title": "synthetic_book_c",
    "genre": "campus-redemption",
    "extracted_at": "2026-08-07",
    "sample_chapters": [
      1,
      2,
      3,
      4,
      5,
      6,
      7,
      8,
      9,
      10,
      12,
      13,
      14,
      15,
      16,
      19,
      20,
      21,
      22,
      23,
      26,
      27
    ],
    "total_sample_words": 26363,
    "confidence": 0.72,
    "human_reviewed": false
  },
  "narration": {
    "pov": "第三人称限知",
    "pov_switch_rule": "",
    "tense_feel": "",
    "sentence_rhythm": {
      "avg_length": 0,
      "short_ratio": 0,
      "long_ratio": 0,
      "burst_pattern": "对话交锋（如第13章命令句）、内心震动（第14章‘心跳如鼓’）、尴尬窘迫（第15章敲门遇冷）。"
    },
    "paragraph": {}
  },
  "dialogue": {
    "dialogue_ratio": 0.2978,
    "tag_style": "1. 指令与抱怨句式（‘把脑袋给我露出来！’‘就暂时记住这四个优点’）。2. 带有昵称（‘唐小雨’）与口语化强势词（‘老子’）的亲昵威压。3. 结巴、气音词（‘我没，我没……’）体现紧张。",
    "subtext_level": "直白",
    "character_voices": [
      {
        "name": "边炀",
        "role": "主角",
        "speech_signature": {
          "refusal_pattern": "当被请求帮助时，先反问「我为什么要帮你？」或「关你屁事？」，表现出极高的防备心。",
          "never_says": [
            "绝不会说「我担心你」、「我保护你」等直白表达关心的话。",
            "绝不会使用敬语或过于礼貌的词汇，例如「您」、「请」。",
            "绝不会主动承认自己的错误或示弱，例如「对不起，我错了」。",
            "绝不会用「我们」来拉近与不熟的人的关系。"
          ],
          "verbal_tics": [
            "自称「老子」，频率极高，尤其在烦躁或不满时。",
            "语句末尾常带「懂？」、「？」或「行不行？」，带有强制对方回应的意味。",
            "使用「特么」、「丫的」等粗口，但非愤怒时多为不耐烦或调侃。",
            "对唐雨的称呼从「你」逐渐变为「唐小雨」，带有戏谑和亲近感。",
            "懒洋洋的语调，常伴随「嗯？」、「哦」等单音节词，语速慢。",
            "拒绝直接表达关心，常用反问或嘲讽掩盖意图，例如「手不要了？」、「脑子怎么想的？」。",
            "威胁时语气平淡但内容狠厉，例如「签字笔从他眼睛上径直落下去」时的描述。",
            "被冒犯时先嗤笑或冷笑，再回击，例如「嗤了声」、「给气笑了」。"
          ]
        },
        "arc": {}
      },
      {
        "name": "孟诗蕊",
        "role": "配角",
        "speech_signature": {
          "refusal_pattern": "对不符合她心意的人或事，直接用暴力威胁或言语侮辱，例如「再敢跑我弄死你」。",
          "never_says": [
            "绝不会对唐雨说任何友善或鼓励的话。",
            "绝不会承认自己有错或道歉。",
            "绝不会在周寻文面前表现出对唐雨的敌意，除非在私下。"
          ],
          "verbal_tics": [
            "自称「我」，频繁提及「我家」、「我爸」，强调家世背景。",
            "使用大量侮辱性词汇，如「狐狸精」、「贱民」、「浪货」、「臭婊子」。",
            "语句常以感叹号结尾，语气嚣张、威胁性强。",
            "喜欢用「警告」、「弄死你」等直接威胁词汇。",
            "在周寻文面前语气会变得俏皮、撒娇，如「寻文哥哥」。",
            "命令句式多，例如「把她衣服扒了」、「赶紧拍完照片」。"
          ]
        },
        "arc": {}
      },
      {
        "name": "唐雨",
        "role": "配角",
        "speech_signature": {
          "refusal_pattern": "几乎不直接拒绝，而是用沉默、低头或低声否认来应对，例如「我没有」、「不是故意的」。",
          "never_says": [
            "绝不会主动挑衅或辱骂他人。",
            "绝不会大声反驳或争辩。",
            "绝不会对孟诗蕊说「你欺负我」等直接指控的话，除非在极度绝望时向边炀求助。"
          ],
          "verbal_tics": [
            "自称「我」，声音常描述为「很低」、「很细」、「小声」。",
            "语句常以「吧」、「呢」、「了」等语气词结尾，显得迟疑或软弱。",
            "在请求帮助时语气卑微，例如「你能不能帮帮我？」、「只要熬过高考的这三个月，这三个月期间你让我做什么都行！」。",
            "常用「对不起」、「谢谢」、「没事」等简短回应，避免冲突。",
            "被威胁时，会用「我没有」、「我不是故意的」等否认或解释。"
          ]
        },
        "arc": {}
      },
      {
        "name": "周寻文",
        "role": "配角",
        "speech_signature": {
          "refusal_pattern": "对孟诗蕊的无理要求，会用温和的质疑式劝阻（先指出对方不足、再劝其务实），语气礼貌但略带说教。",
          "never_says": [
            "绝不会说侮辱性或攻击性的话语。",
            "绝不会公开批评孟诗蕊。",
            "绝不会对唐雨表现出明显的偏袒，以免刺激孟诗蕊。"
          ],
          "verbal_tics": [
            "自称「我」，语气温和有礼，常用「同学」称呼他人。",
            "语句常以「吧」、「呢」等语气词结尾，显得谦和。",
            "夸奖他人时具体且真诚，例如「唐雨，你的字真好看，数学题解得也很漂亮」。",
            "在孟诗蕊面前会表现出宠溺和无奈，例如「摸了摸她的头发，略带宠溺」。"
          ]
        },
        "arc": {}
      }
    ]
  },
  "emotion_handling": {
    "mode": "混合式",
    "body_reaction_vocabulary": [
      "手指都捏白了",
      "耷拉着脑袋",
      "声若蚊鸣",
      "心跳如鼓"
    ],
    "examples": [
      {
        "emotion": "通用",
        "pattern": "以「体感式」为基底（70%），在情感外放场景转为「动作外化式」（25%），在独白或内心剖白时使用少量「直陈式」（5%）。核心规律：生理反应前置，动作次之，直接情绪词最少。",
        "anti_pattern": "完全回避古风、宏大叙事或高度文学化的词汇系统。"
      }
    ]
  },
  "imagery": {
    "high_freq_metaphor_domains": [
      "动物（‘撸小动物似的揉揉’）",
      "日常物件/生活场景（‘你是乌龟吗你’）"
    ],
    "sensory_preference": {},
    "signature_devices": []
  },
  "banned": {
    "never_used_words": [
      "雷雨",
      "刀剑",
      "宫殿",
      "星辰",
      "绝望",
      "深邃",
      "凝视",
      "如同"
    ],
    "avoided_structures": [],
    "genre_taboos": []
  },
  "provenance": {
    "contains_verbatim": false,
    "abstraction_note": "四遍扫描产物，经 compliance.py 扫描，连续12字匹配原文已拒收"
  }
}